{
  "$schema": "https://json-schema.org/draft/2020-12/schema",
  "title": "CCAF concept explainers",
  "type": "array",
  "items": {
    "type": "object",
    "additionalProperties": false,
    "required": ["task_statement", "domain", "title", "concept", "why_it_matters", "common_trap"],
    "properties": {
      "task_statement": { "type": "string", "pattern": "^[1-5]\\.[0-9]+$" },
      "domain": { "type": "integer", "minimum": 1, "maximum": 5 },
      "title": { "type": "string", "minLength": 1 },
      "concept": { "type": "string", "minLength": 1 },
      "why_it_matters": { "type": "string", "minLength": 1 },
      "common_trap": { "type": "string", "minLength": 1 },
      "lab": { "type": ["string", "null"], "pattern": "^lab-[0-9]{2}-" }
    }
  }
}
