[
  {
    "task_statement": "1.1",
    "domain": 1,
    "title": "The Agentic Loop and stop_reason",
    "concept": "An agentic loop repeatedly sends requests to Claude and inspects the API's `stop_reason`. While `stop_reason` is `\"tool_use\"`, the loop executes the requested tools and appends their `tool_result` blocks to the conversation history so the model can reason about the next action; when `stop_reason` is `\"end_turn\"`, the loop terminates and returns the final response. Tool selection is model-driven: Claude decides the next tool from the evolving context rather than following a pre-configured decision tree or fixed sequence.",
    "why_it_matters": "Building control flow on the structured `stop_reason` signal makes agents adaptive and reliable, letting Claude dynamically choose tools instead of being locked into a brittle, hard-coded script.",
    "common_trap": "Terminating the loop by parsing natural-language completion phrases, treating an arbitrary iteration cap as the primary stop, or checking assistant text content as a completion indicator instead of relying on `stop_reason` (`\"end_turn\"`).",
    "lab": "lab-03-agentic-loop"
  },
  {
    "task_statement": "1.2",
    "domain": 1,
    "title": "Coordinator-subagent orchestration in hub-and-spoke multi-agent systems",
    "concept": "A hub-and-spoke multi-agent system centers on a coordinator (the hub) that owns orchestration: it decomposes the query, delegates subtasks to specialized subagents (the spokes), routes all inter-subagent communication and error handling through itself, and aggregates results. Subagents run with isolated context, so they do not inherit the coordinator's history or each other's findings; needed context must be passed explicitly in their prompts. A capable coordinator analyzes query complexity to dynamically select which subagents to invoke instead of always running the full pipeline, partitions research scope across subagents (distinct subtopics or source types) to minimize duplication, and runs iterative refinement loops: evaluate the synthesis output for gaps, re-delegate targeted queries to search and analysis subagents, and re-invoke synthesis until coverage is sufficient.",
    "why_it_matters": "The exam repeatedly tests whether you can locate a failure at the orchestration layer rather than blaming a subagent that executed its assigned scope correctly. Understanding isolated context, centralized routing, dynamic selection, scope partitioning, and refinement loops lets you diagnose coverage gaps, latency, and reliability problems and choose proportionate fixes (e.g., broadening decomposition or adding a scoped tool) instead of over-provisioning agents.",
    "common_trap": "Assuming subagents share memory or that a subagent's success means the overall task succeeded. When a broad report misses whole domains, the cause is usually the coordinator's overly narrow decomposition, not a downstream search, analysis, or synthesis agent that worked correctly within the scope it was given.",
    "lab": "lab-19-multi-agent-orchestration"
  },
  {
    "task_statement": "1.3",
    "domain": 1,
    "title": "Subagent invocation, context passing, and spawning",
    "concept": "Coordinators spawn subagents through the Task tool, which requires `\"Task\"` in the coordinator's `allowedTools`. Each subagent type is configured by an `AgentDefinition` (description, system prompt, tool restrictions). Subagents run with ISOLATED context: they do not inherit the coordinator's history or share memory, so all needed context, including complete prior findings, must be provided explicitly in the subagent's prompt, ideally as structured data that separates content from metadata (source URLs, document names, page numbers, dates) to preserve attribution. Parallel subagents are launched by emitting multiple Task calls in a single response; fork-based session management lets you explore divergent approaches from a shared analysis baseline. Coordinator prompts should state goals and quality criteria, not step-by-step procedures.",
    "why_it_matters": "These are the exact mechanics that make multi-agent systems work or fail. Forgetting `\"Task\"` silently disables delegation; assuming context inheritance produces subagents that ignore prior findings; sequential spawning wastes latency that parallel Task calls would recover; and unstructured context passing corrupts citations during synthesis.",
    "common_trap": "Believing subagents automatically inherit the coordinator's conversation or share a common memory. They do not. Referring a subagent to 'the earlier results' passes nothing; the complete findings must be embedded in its prompt.",
    "lab": "lab-19-multi-agent-orchestration"
  },
  {
    "task_statement": "1.4",
    "domain": 1,
    "title": "Enforcement and handoff patterns in multi-step workflows",
    "concept": "Multi-step agent workflows can order steps two ways. Prompt-based guidance (system-prompt rules, few-shot examples) influences the model probabilistically. Programmatic enforcement (hooks and prerequisite gates) intercepts tool calls and blocks a downstream action until a prerequisite has demonstrably completed—for example, blocking process_refund until get_customer has returned a verified customer ID. Enforcement pairs with two other skills: decomposing multi-concern requests into distinct items investigated in parallel over shared context before a unified resolution, and compiling structured handoff summaries (customer ID, root cause, amount, recommended action) when escalating to humans who lack the transcript.",
    "why_it_matters": "Prompt instructions alone have a non-zero failure rate. When a specific sequence is safety- or money-critical (identity verification before financial operations), that residual failure rate causes misidentified accounts and incorrect refunds. A prerequisite gate converts a probabilistic hope into a deterministic guarantee, which is what compliance-critical business logic requires.",
    "common_trap": "Assuming a sufficiently strong system prompt or enough few-shot examples can guarantee ordering. They reduce but never eliminate the failure rate; only a programmatic gate that blocks the call gives deterministic compliance. A related trap is confusing tool routing (which tools are available) with tool ordering (which must run first)—routing does not enforce sequence.",
    "lab": "lab-11-hooks-and-enforcement"
  },
  {
    "task_statement": "1.5",
    "domain": 1,
    "title": "Agent SDK Hooks for Tool Interception and Data Normalization",
    "concept": "Agent SDK hooks let you insert deterministic code around tool execution. A PostToolUse hook intercepts a tool's returned result and transforms it (for example, normalizing Unix timestamps, ISO 8601 strings, and numeric status codes from different MCP tools into one canonical format) before the model processes it. An outgoing tool-call interception hook inspects the tool call the model requested before it executes, allowing you to enforce compliance rules such as blocking refunds above $500 and redirecting the action to a human-escalation workflow.",
    "why_it_matters": "Prompt instructions only make compliance probabilistic; the model may still violate a rule some fraction of the time. Hooks run in code every time, providing deterministic guarantees. When a rule protects money, privacy, or safety, that certainty is essential, and normalizing data at the hook layer keeps the model from misreading heterogeneous tool outputs.",
    "common_trap": "Assuming a strongly worded system prompt (or a lower temperature, or a capable model) is equivalent to a hook. It is not: only a hook guarantees enforcement. The mirror-image trap is over-engineering by wrapping soft stylistic preferences in hooks when probabilistic prompt guidance would suffice.",
    "lab": "lab-11-hooks-and-enforcement"
  },
  {
    "task_statement": "1.6",
    "domain": 1,
    "title": "Task decomposition strategies: prompt chaining vs. dynamic adaptive decomposition",
    "concept": "Complex workflows are decomposed one of two ways. A fixed sequential pipeline (prompt chaining) hard-wires a known set of subtasks in a known order—for example, reviewing each file individually for local issues, then running a separate cross-file integration pass. Dynamic adaptive decomposition instead generates subtasks from what each step discovers, revising the plan as new dependencies surface—for example, mapping a legacy codebase's structure, finding high-impact areas, then building a prioritized test plan that adapts.",
    "why_it_matters": "Matching the pattern to the workflow drives reliability. Predictable, multi-aspect work runs best on a fixed chain, which is repeatable and cheap to reason about. Open-ended investigation needs adaptation because its subtasks are unknowable in advance. Splitting large reviews into per-file passes plus an integration pass also defeats attention dilution—the cause of shallow, inconsistent, and contradictory single-pass feedback.",
    "common_trap": "Assuming a larger context window fixes a bad multi-file review. Context size controls how much fits in the prompt, not attention quality—packing many files into one pass still dilutes per-file focus. The structural fix is decomposition (per-file passes plus an integration pass), not a bigger model or majority voting over the same diluted pass.",
    "lab": "lab-16-decomposition-and-review"
  },
  {
    "task_statement": "1.7",
    "domain": 1,
    "title": "Managing session state: resumption, forking, and knowing when context is stale",